Symptoms,Disease,Causes,Treatment
"a runny nose or sneezing
pain or tenderness around your cheeks, eyes or forehead
coughing, wheezing or breathlessness
itchy skin rash (hives)
diarrhoea
feeling or being sick
swollen eyes, lips, mouth or throat",Allergies,"tree and grass pollen (hay fever)
house dust mites
foods, such as peanuts, milk and eggs (food allergy)
animal fur, particularly from pets like cats and dogs
insect stings, such as bee and wasp stings
certain medicines","trying to avoid the thing you're allergic to whenever possible
medicines for mild allergic reactions like antihistamines, steroid tablets and steroid creams
emergency medicines called adrenaline auto-injectors, such as an EpiPen, for severe allergic reactions
desensitisation (immunotherapy) for severe allergic reactions – this involves carefully exposing you to the thing you're allergic to over time, so your body gradually gets used to it and does not react so badly (this should only be done by a medical professional)"
"a whistling sound when breathing (wheezing) breathlessness
a tight chest, which may feel like a band is tightening around it
coughing",Asthma,"Asthma is caused by swelling (inflammation) of the breathing tubes that carry air in and out of the lungs. This makes the tubes highly sensitive, so they temporarily narrow.","Asthma is usually treated by using an inhaler, a small device that lets you breathe in medicines."
"a very high temperature or feeling hot or shivery
aching muscles
headache
a cough or shortness of breath",Bird-flu,"Bird flu is spread by close contact with an infected bird (dead or alive).

This includes:

touching infected birds
touching droppings or bedding
killing or preparing infected poultry for cooking
Markets where live birds are sold can also be a source of bird flu.","you'll be advised to stay at home, or you'll be cared for in hospital in isolation from other patients.
You may be given an antiviral medicine such as oseltamivir (Tamiflu) or zanamivir (Relenza)."
"persistent bone pain that gets worse over time and continues into the night
swelling and redness (inflammation) over a bone, which can make movement difficult if the affected bone is near a joint
a noticeable lump over a bone
a weak bone that breaks (fractures) more easily than normal
problems moving around – for example, walking with a limp",Bone Cancer, ,"Treatment for bone cancer depends on the type of bone cancer you have and how far it has spread.

Most people have a combination of:

surgery to remove the section of cancerous bone – it's often possible to reconstruct or replace the bone that's been removed, but amputation is sometimes necessary
chemotherapy – treatment with powerful cancer-killing medicine
radiotherapy – where radiation is used to destroy cancerous cells"
"changes in your poo, such as having softer poo, diarrhoea or constipation that is not usual for you
needing to poo more or less often than usual for you
blood in your poo, which may look red or black
bleeding from your bottom
often feeling like you need to poo, even if you've just been to the toilet
tummy pain
bloating
losing weight without trying
feeling very tired for no reason",Bowel cancer,"you're over 50
you smoke
you're overweight
a close relative has had bowel cancer
you have inflammatory bowel disease, which includes Crohn's disease and ulcerative colitis
you have small growths in your bowel called bowel polyps
you have Lynch Syndrome or familial adenomatous polyposis","Surgery may be carried out to remove cancer from the bowel. Part or all of the bowel around the cancer may also need to be removed.
Chemotherapy is medicine that kills cancer cells.
You may have chemotherapy for bowel cancer:

after surgery to try to stop the cancer coming back
if you're unable to have surgery
if cancer has spread to other parts of your body

Radiotherapy uses radiation to kill cancer cells. A machine is used to target beams of radiation directly at tumours.
Targeted medicines kill cancer cells.

Immunotherapy is where medicines are used to help your immune system kill cancer.
If you've been diagnosed with advanced bowel cancer, it may be hard to treat and not possible to cure.

The aim of treatment will be to slow down the growth and spread of the cancer, to help with the symptoms, and help you live longer."
"headaches
seizures (fits)
persistently feeling sick (nausea), being sick (vomiting) and drowsiness
mental or behavioural changes, such as memory problems or changes in personality
progressive weakness or paralysis on one side of the body
vision or speech problems",Brain Tumours,"The cause of most brain tumours is unknown, but there are several risk factors that may increase your chances of developing a brain tumour.","Treatments for brain tumours include:

steroids
medicines to help with symptoms
surgery
radiotherapy
chemotherapy"
"a new lump or area of thickened tissue in either breast that was not there before
a change in the size or shape of one or both breasts
a discharge of fluid from either of your nipples
a lump or swelling in either of your armpits
a change in the look or feel of your skin, such as puckering or dimpling, a rash or redness
a rash (like eczema), crusting, scaly or itchy skin or redness on or around your nipple
a change in the appearance of your nipple, such as becoming sunken into your breast",Breast cancer in women,"The risk of developing breast cancer increases with age.
If you have close relatives who have had breast cancer or ovarian cancer, you may have a higher risk of developing breast cancer.
If you have previously had breast cancer or early non-invasive cancer cell changes in breast ducts, you have a higher risk of developing it again
Dense breast tissue
The female hormone oestrogen can sometimes stimulate breast cancer cells and cause them to grow.
Hormone replacement therapy (HRT) is associated with an increased risk of developing breast cancer.
Research shows that women who take the contraceptive pill have a slightly increased risk of developing breast cancer
If you have experienced the menopause and are overweight or obese, you may be more at risk of developing breast cancer.
Drinking alcohol increases the risk of getting breast cancer.
Certain medical procedures that use radiation, such as X-rays and CT scans, may slightly increase your risk of developing breast cancer."," There are 2 main types of breast cancer surgery:

breast-conserving surgery, where the cancerous lump (tumour) is removed
mastectomy, where the whole breast is removed

breast radiotherapy – after breast-conserving surgery, radiation is applied to the whole of the remaining breast tissue
chest-wall radiotherapy – after a mastectomy, radiotherapy is applied to the chest wall
breast boost – some women may be offered a boost of high-dose radiotherapy in the area where the cancer was removed; however, this may affect the appearance of your breast, particularly if you have large breasts, and can sometimes have other side effects, including hardening of breast tissue (fibrosis)
radiotherapy to the lymph nodes – where radiotherapy is aimed at the armpit (axilla) and the surrounding area to kill any cancer that may be in the lymph nodes

Chemotherapy involves using anti-cancer (cytotoxic) medicine to kill cancer cells.

Hormone therapy lowers the levels of oestrogen or progesterone hormones in your body or stops their effects.

Targeted therapies are medicines that change the way cells work and help to stop cancer from growing and spreading. Not all types of breast cancer can be treated with targeted therapies
"
"Coughing, chest pain and breathlessness
Changes in bowel habits
tummy discomfort
blood in your poo
pain in your stomach or bottom (anus)
your poo is loose, pale or looks greasy
bloating for 3 weeks or more.
blood in your urine
vaginal bleeding between periods
vaginal bleeding a year or more after the menopause
bleeding from your bottom
blood when you cough
blood in my vomit
lump in my breast 
have a mole
lost a lot of weight
pain anywhere in your tummy or back
",Cancer,"Genetic Factors: Inherited mutations can increase cancer risk.
DNA Mutations: Acquired mutations in DNA over time.
Carcinogens: Exposure to cancer-causing substances.
Tobacco: Leading cause of lung and oral cancers.
Diet: Poor dietary choices, including processed foods.
Obesity: Increased risk for multiple cancers.
Physical Inactivity: Sedentary lifestyle linked to cancer risk.
Alcohol: Excessive consumption raises cancer risk.
Infections: HPV, hepatitis B and C can lead to cancer.
Radiation: Exposure to ionizing radiation increases risk.
Hormones: Hormone-related factors impact breast and ovarian cancer risk.
Chronic Inflammation: Long-term inflammation associated with cancer risk"," healthy eating
taking regular exercise
not smoking
chemotherapy – powerful cancer-killing medicines
radiotherapy – the controlled use of high-energy X-rays"
"continuous low mood or sadness
feeling hopeless and helpless
having low self-esteem
feeling tearful
feeling guilt-ridden
feeling irritable and intolerant of others
having no motivation or interest in things
finding it difficult to make decisions
not getting any enjoyment out of life
feeling anxious or worried
having suicidal thoughts or thoughts of harming yourself",Depression,"Illness
Alcohol and drugs
Loneliness
Menopause
Pregnancy and giving birth
Family history
Personality
Stressful events","If a GP diagnoses you with mild depression, they may suggest waiting a short time to see if it gets better by itself.
Guided self-help
Your GP may suggest trying guided self-help to see if it can help with your depression.
There's evidence that exercise can help depression, and it's one of the main treatments for mild depression.
If you have mild depression that's not improving, you may find a talking therapy helpful.
Antidepressants are medicines that treat the symptoms of depression. There are many different types of antidepressant.
take a course of antidepressants plus talking therapy
If you have severe depression, you may be referred to a mental health team made up of psychologists, psychiatrists, specialist nurses and occupational therapists.
Talking therapies
Cognitive behavioural therapy (CBT)
Interpersonal therapy (IPT)
Behavioural activation
Individual problem-solving
Psychodynamic psychotherapy
Counselling
Behavioural couples therapy"
"feeling very thirsty
peeing more frequently than usual, particularly at night
feeling very tired
weight loss and loss of muscle bulk
itching around the penis or vagina, or frequent episodes of thrush
blurred vision",Diabetes,"are living with overweight or obesity
do not have a healthy diet
have a family history of type 2 diabetes
are of Asian, Black African or African Caribbean origin
take certain medicines such as steroids for a long time
have high blood pressure
have had gestational diabetes during pregnancy
Diabetes can damage the nerves in your feet and cause a loss of feeling. It can also reduce the blood supply to your feet.
If you have diabetes, your eyes are at risk from diabetic retinopathy, a condition that can lead to sight loss if it's not treated.","Medications (e.g., metformin medicine), diet control, exercise 
Regular monitoring of blood glucose levels is essential for individuals with Type 1 diabetes.
Many individuals with Type 1 diabetes use carbohydrate counting to help match their insulin doses to the amount of carbohydrates they consume.
A balanced diet is important for people with Type 1 diabetes. Meeting with a registered dietitian.
Regular physical activity is beneficial for managing blood sugar levels.
Stress, illness, and changes in routine can affect blood sugar levels.
Insulin Therapy"
"a high temperature
difficulty breathing – babies may make grunting noises
being sleepier than normal or difficult to wake
blue, grey, pale or blotchy skin, lips or tongue – on brown or black skin this may be noticeable under the nails or around the eyes
a rash that looks like small bruises or bleeding under the skin and does not disappear when you press a glass against it
a headache
a sore throat
swollen or painful joints",Haemophilus influenzae type b (Hib),"infection of the lining of the brain and spinal cord (meningitis)
a severe immune reaction (sepsis)
infection of part of your windpipe (epiglottitis)
infection of the lungs (pneumonia)
You can become very ill with these conditions and will need treatment in hospital.","Vaccination is the best way to prevent serious Hib infections.
Vaccines that protect against Hib are offered to babies as part of the NHS vaccination schedule.

The main treatment for a Hib infection is antibiotics. You'll usually need to be treated in hospital.
You may be given oxygen and other medicines such as steroids, depending on your symptoms. Other treatments, including surgery, may also be needed.
If you have a Hib infection, your close contacts, such as anyone you live with, may be offered antibiotics to stop them getting ill.

"
"blood pressure is high
Severe headaches
headaches in back of the head
acute hypertension.
nosebleeds
experience shortness of breath
chest pain or discomfort during physical exertion",Hypertension (High Blood Pressure),"are overweight
eat too much salt and do not eat enough fruit and vegetables
do not do enough exercise
drink too much alcohol or coffee (or other caffeine-based drinks)
smoke
have a lot of stress
are over 65
have a relative with high blood pressure
are of black African or black Caribbean descent
live in a deprived area","cut your salt intake to less than 6g (0.2oz) a day, which is about a teaspoonful – find out how you can reduce the amount of salt in your diet
eat a low-fat, balanced diet – including plenty of fresh fruit and vegetables; get tips on eating more healthily
be active – read some tips about getting more exercise
cut down on alcohol – get tips on cutting down, including downloading a drinks diary and keeping track of your drinking
lose weight – find out what your ideal weight is using the BMI healthy weight calculator and read advice about losing weight if you're overweight
drink less caffeine – found in coffee, tea and cola
stop smoking – get help quitting

if you're under 55 years of age, or you're any age and have type 2 diabetes – you'll usually be offered an ACE inhibitor or an angiotensin-2 receptor blocker (ARB)
if you're aged 55 or older, or you're any age and of African or Caribbean origin, and you do not have type 2 diabetes – you'll usually be offered a calcium channel blocker"
"a sudden high temperature
an aching body
feeling tired or exhausted
a dry cough
a sore throat
a headache
difficulty sleeping
loss of appetite
diarrhoea or tummy pain
feeling sick and being sick",Influenza (Flu),"Influenza is primarily caused by influenza viruses, which belong to the Orthomyxoviridae family.
The flu is primarily spread from person to person through respiratory droplets when an infected person coughs, sneezes, or talks.","Flu will often get better on its own, but it can make some people seriously ill. It's important to get the flu vaccine if you're advised to.

rest and sleep

keep warm

take paracetamol or ibuprofen to lower your temperature and treat aches and pains

drink plenty of water to avoid dehydration (your pee should be light yellow or clear)"
"tiredness
swollen ankles, feet or hands
shortness of breath
feeling sick
blood in your pee (urine)",Kidney Disease,"Chronic kidney disease is usually caused by other conditions that put a strain on the kidneys. Often it's the result of a combination of different problems.

CKD can be caused by:

high blood pressure – over time, this can put strain on the small blood vessels in the kidneys and stop the kidneys working properly
diabetes – too much glucose in your blood can damage the tiny filters in the kidneys
high cholesterol – this can cause a build-up of fatty deposits in the blood vessels supplying your kidneys, which can make it harder for them to work properly
kidney infections
glomerulonephritis – kidney inflammation
autosomal dominant polycystic kidney disease – an inherited condition where growths called cysts develop in the kidneys
blockages in the flow of urine – for example, from kidney stones that keep coming back, or an enlarged prostate
long-term, regular use of certain medicines – such as lithium and non-steroidal anti-inflammatory drugs (NSAIDs)","Most kidney stones are small enough to be passed in your pee, and it may be possible to treat the symptoms at home with medication.

Larger stones may need to be broken up or removed with surgery."
"a cough that does not go away after 3 weeks
a long-standing cough that gets worse
chest infections that keep coming back
coughing up blood
an ache or pain when breathing or coughing
persistent breathlessness
persistent tiredness or lack of energy
loss of appetite or unexplained weight loss",Lung cancer,"Smoking cigarettes is the single biggest risk factor for lung cancer. It's responsible for more than 7 out of 10 cases.
Radon is a natural radioactive gas that comes from tiny amounts of uranium present in all rocks and soils. It can sometimes be found in buildings.
Exposure to certain chemicals and substances which are used in several occupations and industries may increase your risk of developing lung cancer.",Radiotherapy uses pulses of radiation to destroy cancer cells. There are a number of ways it can be used to treat lung cancer. There are 3 main types of lung cancer surgery: lobectomy – where 1 of the large parts of the lung (lobes) is removed. Your doctors will suggest this operation if the cancer is just in 1 section of 1 lung. pneumonectomy – where the entire lung is removed. This is used when the cancer is located in the middle of the lung or has spread throughout the lung. wedge resection or segmentectomy – where a small piece of the lung is removed. This procedure is only suitable for a small number of patients. It is only used if your doctors think your cancer is small and limited to one area of the lung. This is usually very early-stage non-small-cell lung cancer. Chemotherapy uses powerful cancer-killing medicine to treat cancer. Immunotherapy is a group of medicines that stimulate your immune system to target and kill cancer cells. It can be used on its own or combined with chemotherapy. Targeted therapies (also known as biological therapies) are medicines designed to slow the spread of advanced non-small cell lung cancer.
"Vaginal Bleeding
abdominal cramp or pelvic cramp
menstrual cramps.
back pain or pain in the lower abdomen
breast tenderness
Bleeding that progresses from light to heavy",miscarriage,"Most miscarriages occur due to genetic problems in the fetus. These abnormalities prevent the fetus from developing normally.
Hormonal issues in the mother, such as polycystic ovary syndrome (PCOS) or thyroid problems, can contribute to miscarriage.
Certain infections, like rubella, can increase the risk of miscarriage.
Structural problems in the uterus can make it difficult for a pregnancy to be carried to term.
Smoking, alcohol, and drug use can increase the risk of miscarriage.
The risk of miscarriage increases with maternal age, especially after the age of 35.
Conditions like diabetes and autoimmune disorders can increase the risk of miscarriage.","Sometimes, the body expels the pregnancy naturally. In this case, you may not need any medical intervention but should still be monitored by a healthcare provider.
Your doctor may prescribe medication to help your body expel the pregnancy tissue.
If you've experienced multiple miscarriages or have other risk factors, your doctor may recommend further testing to identify any underlying causes and develop a plan for future pregnancies.
If the miscarriage is incomplete or if there are complications, a surgical procedure known as a dilation and curettage (D&C) may be performed.
Coping with a miscarriage can be emotionally challenging. It's essential to seek emotional support from loved ones, support groups, or mental health professionals."
"needing to pee more frequently, often during the night
needing to rush to the toilet
difficulty in starting to pee (hesitancy)
straining or taking a long time while peeing
weak flow
feeling that your bladder has not emptied fully
blood in urine or blood in semen",Prostate cancer,"age – the risk rises as you get older, and most cases are diagnosed in men over 50 years of age
ethnic group – prostate cancer is more common in black men than in Asian men
family history – having a brother or father who developed prostate cancer before age 60 seems to increase your risk of developing it; research also shows that having a close female relative who developed breast cancer may also increase your risk of developing prostate cancer
obesity – recent research suggests there may be a link between obesity and prostate cancer, and a balanced diet and regular exercise may lower your risk of developing prostate cancer
diet – research is ongoing into the links between diet and prostate cancer, and there is some evidence that a diet high in calcium is linked to an increased risk of developing prostate cancer","Surgically removing the prostate gland (radical prostatectomy)
Radiotherapy involves using radiation to kill cancerous cells.
Brachytherapy is a form of radiotherapy where the radiation dose is delivered inside the prostate gland. It's also known as internal or interstitial radiotherapy.
Hormone therapy is often used in combination with radiotherapy. For example, you may receive hormone therapy before undergoing radiotherapy to increase the chance of successful treatment.
Trans-urethral resection of the prostate (TURP)
TURP is a procedure that can help relieve pressure from the tube that carries urine from your bladder out of your penis (urethra) to treat any problematic symptoms you may have with urination.
High-intensity focused ultrasound (HIFU)
HIFU is sometimes used to treat localised prostate cancer that has not spread beyond the prostate.
Cryotherapy is a method of killing cancer cells by freezing them. It's sometimes used to treat localised prostate cancer that has not spread beyond the prostate gland.
Chemotherapy is often used to treat prostate cancer that's spread to other parts of the body (metastatic prostate cancer).
Steroid tablets are used when hormone therapy no longer works because the cancer is resistant to it. This is called castration-resistant prostate cancer (CRPC)."
"peeing more than usual, particularly at night
feeling thirsty all the time
feeling very tired
losing weight without trying to
itching around your penis or vagina, or repeatedly getting thrush
cuts or wounds taking longer to heal
blurred vision","Type 2 diabetes
","heart disease and stroke
loss of feeling and pain (nerve damage)
foot problems – like sores and infections
vision loss and blindness
miscarriage and stillbirth
problems with your kidneys
sexual problems – like problems getting or keeping an erection","Controlling your blood sugar level and having regular diabetes check-ups is the best way to lower your risk of complications.
Medications (e.g., metformin), diet control, exercise
Metformin is the most common medicine for type 2 diabetes. It can help keep your blood sugar at a healthy level.
You'll need insulin if other medicines no longer work well enough to keep your blood sugar within a healthy range."
"a high temperature or shivering (chills) – a high temperature means you feel hot to touch on your chest or back (you do not need to measure your temperature)
a new, continuous cough – this means coughing a lot for more than an hour, or 3 or more coughing episodes in 24 hours
a loss or change to your sense of smell or taste
shortness of breath
feeling tired or exhausted
an aching body
a headache
a sore throat
a blocked or runny nose
loss of appetite
diarrhoea
feeling sick or being sick",COVID-19,"COVID-19 spreads very easily through close contact with people who have the virus.

When someone with COVID-19 breathes, speaks, coughs or sneezes, they release small droplets containing the virus. You can catch it by breathing in these droplets or touching surfaces covered in them.
You can still catch or spread COVID-19 if you:

do not have symptoms
are fully vaccinated
have had the virus before","Nirmatrelvir plus ritonavir, remdesivir and molnupiravir are antiviral medicines.

When being assessed for treatment, a doctor will advise which treatment is most suitable for you."
